{
  "$schema":"https://json-schema.org/draft/2020-12/schema", "type":"object", "additionalProperties":false,
  "required":["schema","distributionLicenseClosure","packages","copiedNoticeFiles"],
  "properties":{
    "schema":{"const":"shieldkit-labs/p2/gate-b/cohort-node-runtime-materialized/v1/license-provenance"},
    "distributionLicenseClosure":{"const":"incomplete-metadata-only-for-glibc"},
    "packages":{"type":"array","items":{"type":"object","additionalProperties":false,"required":["id","name","version","licenses","licenseRefs","noticeFiles","distributionStatus"],"properties":{"id":{"type":"string"},"name":{"type":"string"},"version":{"type":"string"},"licenses":{"type":"array","items":{"type":"string"}},"licenseRefs":{"type":"array","items":{"type":"string"}},"noticeFiles":{"type":"array","items":{"type":"string"}},"distributionStatus":{"type":"string"}}}},
    "copiedNoticeFiles":{"type":"array","items":{"type":"object","additionalProperties":false,"required":["path","source","bytes","mode","nlink","sha256"],"properties":{"path":{"type":"string"},"source":{"type":"string"},"bytes":{"type":"integer"},"mode":{"type":"integer"},"nlink":{"const":1},"sha256":{"type":"string","pattern":"^[0-9a-f]{64}$"}}}}
  }
}
