{"copiedNoticeFiles":[{"bytes":145485,"mode":420,"nlink":1,"path":"licenses/node/LICENSE","sha256":"c738ae413cf561f174e34f6961f8ca458aae2369a73640dda6234c629b98bcc4","source":"/home/toorik/.local/share/mise/installs/node/22.23.1/LICENSE"},{"bytes":3324,"mode":420,"nlink":1,"path":"licenses/host/libgcc/RUNTIME.LIBRARY.EXCEPTION","sha256":"9d6b43ce4d8de0c878bf16b54d8e7a10d9bd42b75178153e3af6a815bdc90f74","source":"/usr/share/licenses/libgcc/RUNTIME.LIBRARY.EXCEPTION"},{"bytes":3324,"mode":420,"nlink":1,"path":"licenses/host/libstdc++/RUNTIME.LIBRARY.EXCEPTION","sha256":"9d6b43ce4d8de0c878bf16b54d8e7a10d9bd42b75178153e3af6a815bdc90f74","source":"/usr/share/licenses/libstdc++/RUNTIME.LIBRARY.EXCEPTION"}],"distributionLicenseClosure":"incomplete-metadata-only-for-glibc","packages":[{"distributionStatus":"notice-materialized","id":"package:node","licenseRefs":["package:node"],"licenses":["MIT","BSD-2-Clause","BSD-3-Clause","ICU","MIT-0"],"name":"node","noticeFiles":["licenses/node/LICENSE"],"version":"22.23.1"},{"distributionStatus":"incomplete-metadata-only","id":"package:glibc","licenseRefs":["package:glibc"],"licenses":["GPL-2.0-or-later","LGPL-2.1-or-later"],"name":"glibc","noticeFiles":[],"version":"2.43+r37+gfdf10644d6ee-1"},{"distributionStatus":"notice-materialized","id":"package:libstdc++","licenseRefs":["package:libstdc++"],"licenses":["GPL-3.0-or-later WITH GCC-exception-3.1","GFDL-1.3-or-later"],"name":"libstdc++","noticeFiles":["licenses/host/libstdc++/RUNTIME.LIBRARY.EXCEPTION"],"version":"16.1.1+r346+g4e03491b401d-4"},{"distributionStatus":"notice-materialized","id":"package:libgcc","licenseRefs":["package:libgcc"],"licenses":["GPL-3.0-or-later WITH GCC-exception-3.1","GFDL-1.3-or-later"],"name":"libgcc","noticeFiles":["licenses/host/libgcc/RUNTIME.LIBRARY.EXCEPTION"],"version":"16.1.1+r346+g4e03491b401d-4"}],"schema":"shieldkit-labs/p2/gate-b/cohort-node-runtime-materialized/v1/license-provenance"}
